raw_value,nlu_skill,nlu_task,nlu_result_is_valid,nlu_result_tts_task_type,nlu_result_tts_text
春阳,,poem_title_lookup.content_lookup,True,poem_title_lookup.content_lookup,春阳 ，宋代， 孔平仲 ，春阳已出地，冰雪尚峥嵘。半作泥涂湿，尤妨车马行。溪流成小派，海气乱新晴。湮鬰须披豁，谁同上古城。
向光性,baike,baike,True,baike,植物生长器官受单方向光照射而引起生长弯曲的现象称为向光性。对高等植物而言，向光性主要指植物地上部分茎叶的正向光性。以前认为根没有向光性反应，然而近年来以拟南芥为研究材料，发现根有负向光性。植物的向光性以嫩茎尖、胚芽鞘和暗处生长的幼苗最为敏感。生长旺盛的向日葵、棉花等植物的茎端还能随太阳而转动。向光性是植物的一种生态反应，如茎叶的向光性，能使叶子尽量处于吸收光能的最适位置进行光合作用。
洄游,baike,baike,True,baike,洄游[一种鱼类运动]:洄游动力: 2种。 洄游（migration）是鱼类运动的一种特殊形式，是一些鱼类的主动、定期、定向、集群、具有种的特点的水平移动。
抠门,zh_dic,zh_dic_word_lookup.meaning_lookup,False,zh_dic_word_lookup.meaning_lookup,小猴没找到抠门的意思，我先把它记下来
白晃晃,zh_dic,zh_dic_word_lookup.meaning_lookup,False,zh_dic_word_lookup.meaning_lookup,小猴没找到白晃晃的意思，我先把它记下来
气定神闲,,poem_sentence_lookup.content_lookup,True,poem_sentence_lookup.content_lookup,"这是题巴陵宰邓器先北窗中的诗句
题巴陵宰邓器先北窗 ，唐代， 王炎 ，权利炙手热，争道俱着鞭。鸡鸣已盥栉，日莫未息肩。中宵一假寐，梦想游钧天。达人袖手观，方寸常超然。冰壶不受暑，凛凛含清寒。消摇北窗下，俯仰宇宙宽。千诗句有眼，一曲琴无絃。开尊对白堕，拂榻饱黑甜。功名不挂念，气定神自闲。渊明亦一出，未倦飞已还。我常疑若人，本不欲闭关。漫仕今墨绶，阅世垂苍颜。卷舒各有时，隠显皆足贤。先正文昌丞，玉立四近班。风流被后昆，世以忠孝传。丹扆新日月，黄图旧山川。故家乔木高，义气许国坚。前贤经济心，不在轩冕间。才猷时所须，何得无里言。高枕恐未稳，鸣珂终小骞。煌煌汉元侯，事业光青编。"
绵延不绝,zh_dic,no_task,False,no_task,抱歉，小猴没听懂。
形同陌路,zh_dic,zh_dic_idiom_lookup.meaning_lookup,False,zh_dic_idiom_lookup.meaning_lookup,小猴没找到形同陌路这个成语，我先把它记下来
贬词,,poem_title_lookup.content_lookup,True,poem_title_lookup.content_lookup,边词 ，唐代， 张敬忠 ，五原春色旧来迟，二月垂杨未挂丝。即今河畔冰开日，正是长安花落时。
偏口鱼,baike,baike,True,baike,偏口鱼: 偏口鱼，即比目鱼，高眼鲽，是硬骨鱼纲鲽形目鱼类的总称，包括鰜科、鲆科、鲽科、鳎科、舌鳎科鱼类。科: 鰜科、鲆科、鲽科、鳎科、舌鳎科。
命数,,poem_title_lookup.content_lookup,True,poem_title_lookup.content_lookup,命书 ，宋代， 陈造 ，命书唐滥觞，委源传吕后。有倡莫为遏，波荡今不救。字育叵数计，八字讵所囿。甲子动垓亿，举一百万漏。荒唐无稽据，诵言指休咎。柰何聪达人，颇复安此谬。怀刺曳长裾，偃蹇文士右。夸诩走干谒，荐墨不待叩。士有待濡沬，百请不一售。我昔游江淮，知识间新旧。文士不到眼，此辈日交簉。辞章轻杯水，羡彼行橐富。鳃鳃问利禄，吾儒所深陋。自笑与世违，迂论取排诟。
茶褐色,baike,baike,False,baike,抱歉，小猴答不上来
船家,baike,baike,True,baike,船家: 船家是一个汉语词语，拼音是chuán jīa，意思是靠营运或捕捞为生计的船户。拼音: chuán jīa。
薄情寡义,zh_dic,zh_dic_idiom_lookup.meaning_lookup,False,zh_dic_idiom_lookup.meaning_lookup,小猴没找到薄情寡义这个成语，我先把它记下来
激浪,zh_dic,zh_dic_word_lookup.meaning_lookup,False,zh_dic_word_lookup.meaning_lookup,小猴没找到激浪的意思，我先把它记下来
朝气勃勃,zh_dic,zh_dic_idiom_lookup.meaning_lookup,False,zh_dic_idiom_lookup.meaning_lookup,小猴没找到朝气勃勃这个成语，我先把它记下来
欲取姑与,,poem_title_lookup.content_lookup,False,poem_title_lookup.content_lookup,小猴没有找到相关的诗词信息
驾鹤西去,,poem_title_lookup.content_lookup,False,poem_title_lookup.content_lookup,小猴没有找到相关的诗词信息
用计铺谋,,poem_sentence_lookup.content_lookup,True,poem_sentence_lookup.content_lookup,"这是刘玄德醉走黄鹤楼・尾声中的诗句
刘玄德醉走黄鹤楼・尾声 ，唐代， 无名氏 ，他那里明明的捧着瑶觞，暗暗的藏着军将，用计铺谋怎防？着主公坐在那难走难逃筵会上，你心下自索参详，自度量，不比寻常，他则待赚虎离窝入地网。刘封云哎，赵叔，你不知道，那黄鹤楼近在水边。若水长呵，我安排战船，搭起浮桥，接应我父亲。他便跌下水去，落的他睡一觉。正末唱那黄鹤楼接大水长，翻波滚浪，正末云若主公不听赵云谏当呵。唱知他是甚风儿吹过汉阳江？下刘封云老赵，你去，我父亲他也不听你说。父亲走一遭，则管嚼食去。刘末云刘封，你与赵云紧守着城池。则着三五骑人马，跟我过江，直至黄鹤楼上赴宴，走一遭去。子龙心下莫踌躇，今朝止马践程途。过江亲赴碧莲会，直至那黄鹤楼上见周瑜。下刘封云父亲去了也。为甚么我赍发的俺父亲过江去？那周瑜是个是智多谋的人，俺父亲若有些好歹，他这个位，就是我承袭。凭着我这般好心肠，天也与我半碗饭吃。下。"
刁顽,baike,baike,True,baike,刁顽: 刁顽，汉语词汇。出处: 元·关汉卿《鲁斋郎》第三折。
前程似锦,zh_dic,zh_dic_idiom_lookup.meaning_lookup,False,zh_dic_idiom_lookup.meaning_lookup,小猴没找到前程似锦这个成语，我先把它记下来
因特网,baike,baike,True,baike,因特网（Internet）是一组全球信息资源的总汇。有一种粗略的说法，认为INTERNET是由于许多小的网络（子网）互联而成的一个逻辑网，每个子网中连接着若干台计算机（主机）。Internet以相互交流信息资源为目的，基于一些共同的协议，并通过许多路由器和公共互联网而成，它是一个信息资源和资源共享的集合。
分爨,zh_dic,zh_dic_word_lookup.meaning_lookup,False,zh_dic_word_lookup.meaning_lookup,小猴没找到分爨的意思，我先把它记下来
游山逛水,,poem_title_lookup.content_lookup,True,poem_title_lookup.content_lookup,游山水 ，明代， 陈繗 ，山色连云断，霞光照水飞。浪奔船势疾，波阔橹声微。水鸟翔还集，江花密更稀。五湖灯景好，范蠡亦忘归。
公共场所,zh_dic,no_task,False,no_task,抱歉，小猴没听懂。
卧房,zh_dic,zh_dic_word_lookup.meaning_lookup,False,zh_dic_word_lookup.meaning_lookup,小猴没找到卧房的意思，我先把它记下来
苦日子,chat,chat.small_talk,False,chat.small_talk,我们先不要聊天啦，好好学习吧！
寂静无声,zh_dic,zh_dic_idiom_lookup.meaning_lookup,False,zh_dic_idiom_lookup.meaning_lookup,小猴没找到寂静无声这个成语，我先把它记下来
晚班,zh_dic,zh_dic_word_lookup.meaning_lookup,False,zh_dic_word_lookup.meaning_lookup,小猴没找到晚班的意思，我先把它记下来
处男,baike,baike,True,baike,处男: 处男，或称童贞、童男、在室男，是指未进行过性交的男性。
黑手,zh_dic,zh_dic_word_lookup.meaning_lookup,False,zh_dic_word_lookup.meaning_lookup,小猴没找到黑手的意思，我先把它记下来
跟包,zh_dic,zh_dic_word_lookup.meaning_lookup,False,zh_dic_word_lookup.meaning_lookup,小猴没找到跟包的意思，我先把它记下来
山珍,baike,baike,True,baike,山珍: 山珍是由中国著名山水画大师——张大千于1979年所创作。作者: 张大千。
官绅,baike,baike,True,baike,官绅: 官绅是一个汉语词汇，读音为guān shēn，是指古代有权有势的官，也指官吏和绅士。解释: 官吏和绅士。
戏班,baike,baike,False,baike,抱歉，小猴答不上来
怆然泪下,,poem_sentence_lookup.content_lookup,True,poem_sentence_lookup.content_lookup,"这是金铜仙人辞汉歌中的诗句
金铜仙人辞汉歌 ，唐代， 李贺 ，魏明帝青龙元年八月，诏宫官牵车西取汉孝武捧露盘仙人，欲立置前殿。宫官既拆盘，仙人临载，乃潸然泪下。唐诸王孙李长吉遂作《金铜仙人辞汉歌》。
茂陵刘郎秋风客，夜闻马嘶晓无迹。画栏桂树悬秋香，三十六宫土花碧。魏官牵车指千里，东关酸风射眸子。空将汉月出宫门，忆君清泪如铅水。衰兰送客咸阳道，天若有情天亦老。携盘独出月荒凉，渭城已远波声小。"
逗弄,zh_dic,zh_dic_word_lookup.meaning_lookup,False,zh_dic_word_lookup.meaning_lookup,小猴没找到逗弄的意思，我先把它记下来
棚车,baike,baike,True,baike,棚车: 棚车，又称篷车，俗称闷罐车，是一种封闭的火车车厢，一般用来运送货物。
经管,zh_dic,zh_dic_word_lookup.meaning_lookup,False,zh_dic_word_lookup.meaning_lookup,小猴没找到经管的意思，我先把它记下来
贬义词,knowledge,no_task,False,no_task,抱歉，小猴没理解。
火柱,,poem_title_lookup.content_lookup,True,poem_title_lookup.content_lookup,火筯 ，宋代， 韦骧 ，劲直不容偏，纤纤体并圆。附炎非曲致，执热借双全。炽炭随方减，寒灰应手然。洪炉在调适，持此以为权。
称扬,zh_dic,zh_dic_word_lookup.meaning_lookup,False,zh_dic_word_lookup.meaning_lookup,小猴没找到称扬的意思，我先把它记下来
法不责众,zh_dic,zh_dic_idiom_lookup.meaning_lookup,False,zh_dic_idiom_lookup.meaning_lookup,小猴没找到法不责众这个成语，我先把它记下来
发痴,zh_dic,zh_dic_word_lookup.meaning_lookup,False,zh_dic_word_lookup.meaning_lookup,小猴没找到发痴的意思，我先把它记下来
衣不重采,zh_dic,zh_dic_idiom_lookup.meaning_lookup,False,zh_dic_idiom_lookup.meaning_lookup,小猴没找到衣不重采这个成语，我先把它记下来
薪火相传,,poem_sentence_lookup.content_lookup,True,poem_sentence_lookup.content_lookup,"这是偈颂三十六首  其三○中的诗句
偈颂三十六首  其三○ ，宋代， 释如珙 ，薪火相交，识性不停。上至诸佛，下至众生。扶过断桥水，伴归明月村。"
泛论,baike,baike,True,baike,泛论: 泛论，拼音是fànlùn，是一个汉语词汇，释义为广泛地论述；泛泛地谈论。
奢求,zh_dic,zh_dic_word_lookup.meaning_lookup,False,zh_dic_word_lookup.meaning_lookup,小猴没找到奢求的意思，我先把它记下来
平反昭雪,zh_dic,zh_dic_idiom_lookup.meaning_lookup,False,zh_dic_idiom_lookup.meaning_lookup,小猴没找到平反昭雪这个成语，我先把它记下来
法外施恩,zh_dic,zh_dic_idiom_lookup.meaning_lookup,False,zh_dic_idiom_lookup.meaning_lookup,小猴没找到法外施恩这个成语，我先把它记下来
软钉子,baike,baike,True,baike,软钉子: 软钉子，读音ruǎndīngzi，汉语词语，基本意思为比喻委婉的回绝或批评。解释: 比喻委婉的回绝或批评。
售出,baike,baike,True,baike,本义：卖出去
歌姬,baike,baike,False,baike,抱歉，小猴答不上来
颓垣断壁,zh_dic,zh_dic_idiom_lookup.meaning_lookup,False,zh_dic_idiom_lookup.meaning_lookup,小猴没找到颓垣断壁这个成语，我先把它记下来
缺课,zh_dic,zh_dic_word_lookup.meaning_lookup,False,zh_dic_word_lookup.meaning_lookup,小猴没找到缺课的意思，我先把它记下来
垫脚石,baike,baike,True,baike,垫脚石: 垫脚石是一个汉语词汇，意思是供步行时踏脚的石头。【解释】: 供步行时踏脚的石头。
看押,zh_dic,zh_dic_word_lookup.meaning_lookup,False,zh_dic_word_lookup.meaning_lookup,小猴没找到看押的意思，我先把它记下来
两鬓斑白,zh_dic,zh_dic_idiom_lookup.meaning_lookup,False,zh_dic_idiom_lookup.meaning_lookup,小猴没找到两鬓斑白这个成语，我先把它记下来
归降,,poem_title_lookup.content_lookup,True,poem_title_lookup.content_lookup,归乡 ，宋代， 张纲 ，穷巷归来已白头，结茅何必榜休休。好山当户碧云晚，明月满谿寒苇秋。诗社纵添新句法，醉乡难觅旧交游。平生幸自无机械，一棹夷由去狎鸥。
吹牛皮,zh_dic,zh_dic_word_lookup.meaning_lookup,False,zh_dic_word_lookup.meaning_lookup,小猴没找到吹牛皮这个词，我先把它记下来
酒坊,,poem_title_lookup.content_lookup,True,poem_title_lookup.content_lookup,酒舫 ，宋代， 刘敞 ，悠悠转小棹，漾漾逐浮萍。载酒和嘉月，投篇弔独醒。
步卒,zh_dic,zh_dic_word_lookup.meaning_lookup,False,zh_dic_word_lookup.meaning_lookup,小猴没找到步卒的意思，我先把它记下来
不二价,chat,chat.small_talk,False,chat.small_talk,我们先不要聊天啦，好好学习吧！
饶沃,baike,baike,True,baike,饶沃: 饶沃是一个汉语词语。释义: 肥沃；富足。
莞尔一笑,,poem_sentence_lookup.content_lookup,True,poem_sentence_lookup.content_lookup,"这是渔歌子中的诗句
渔歌子 ，宋代， 张炎 ，□□□□白云多。童子贪眠枕绿蓑。莞尔笑，浩然歌。奈此萧萧落叶何。"
舍近图远,zh_dic,no_task,False,no_task,抱歉，小猴没理解。
上吊,zh_dic,zh_dic_word_lookup.meaning_lookup,False,zh_dic_word_lookup.meaning_lookup,小猴没找到上吊的意思，我先把它记下来
沾沾自足,zh_dic,zh_dic_idiom_lookup.meaning_lookup,False,zh_dic_idiom_lookup.meaning_lookup,小猴没找到沾沾自足这个成语，我先把它记下来
健朗,zh_dic,zh_dic_word_lookup.meaning_lookup,False,zh_dic_word_lookup.meaning_lookup,小猴没找到健朗的意思，我先把它记下来
和好如初,zh_dic,no_task,False,no_task,抱歉，小猴没听懂。
零售商,baike,baike,False,baike,抱歉，小猴答不上来
舍身取义,zh_dic,no_task,False,no_task,抱歉，小猴没听懂。
喇叭花,baike,baike,True,baike,喇叭花: 牵牛，学名 Pharbitis nil（L.）Choisy，又名牵牛花、喇叭花（各地统称），系旋花科牵牛属一年生缠绕草本，全身具短毛。界: 植物界。
眉眼传情,,poem_sentence_lookup.content_lookup,True,poem_sentence_lookup.content_lookup,"这是蹋莎行（春归怨别）中的诗句
蹋莎行（春归怨别） ，宋代， 曾协 ，柳眼传情，花心蹙恨。春风处处关方寸。朱帘卷尽画屏闲，云鬟半罗衣褪。燕语莺啼，日长人困。鱼沈雁断无音信。琵琶声乱篆烟斜，寸肠欲断无人问。"
地边,zh_dic,zh_dic_word_lookup.meaning_lookup,False,zh_dic_word_lookup.meaning_lookup,小猴没找到地边的意思，我先把它记下来
信心十足,zh_dic,no_task,False,no_task,抱歉，小猴没听清。
大富大贵,zh_dic,zh_dic_idiom_lookup.meaning_lookup,False,zh_dic_idiom_lookup.meaning_lookup,小猴没找到大富大贵这个成语，我先把它记下来
膀臂,zh_dic,zh_dic_word_lookup.meaning_lookup,False,zh_dic_word_lookup.meaning_lookup,小猴没找到膀臂的意思，我先把它记下来
皇储,baike,baike,False,baike,抱歉，小猴答不上来
弥天,baike,baike,True,baike,弥天: 弥天，指满天。
出双入对,zh_dic,no_task,False,no_task,抱歉，小猴没理解。
硬结,baike,baike,True,baike,硬结:释义: 变得坚硬;结成硬的块状。 硬结是一个汉语词汇，意思是变得坚硬;结成硬的块状。
两厢情愿,zh_dic,zh_dic_idiom_lookup.meaning_lookup,False,zh_dic_idiom_lookup.meaning_lookup,小猴没找到两厢情愿这个成语，我先把它记下来
高才硕学,zh_dic,zh_dic_idiom_lookup.meaning_lookup,False,zh_dic_idiom_lookup.meaning_lookup,小猴没找到高才硕学这个成语，我先把它记下来
环环相扣,zh_dic,zh_dic_idiom_lookup.meaning_lookup,False,zh_dic_idiom_lookup.meaning_lookup,小猴没找到环环相扣这个成语，我先把它记下来
归心,zh_dic,zh_dic_word_lookup.meaning_lookup,False,zh_dic_word_lookup.meaning_lookup,小猴没找到归心的意思，我先把它记下来
碰到,zh_dic,zh_dic_word_lookup.meaning_lookup,False,zh_dic_word_lookup.meaning_lookup,小猴没找到碰到的意思，我先把它记下来
雕饰,zh_dic,zh_dic_word_lookup.meaning_lookup,False,zh_dic_word_lookup.meaning_lookup,小猴没找到雕饰的意思，我先把它记下来
扶病,zh_dic,zh_dic_word_lookup.meaning_lookup,False,zh_dic_word_lookup.meaning_lookup,小猴没找到扶病的意思，我先把它记下来
机杼,baike,baike,True,baike,机杼: 机杼，指织布机。俗称: 织布机。
冰点,baike,baike,True,baike,冰点[科技名词]: 冰点外文名ice point，是指水的凝固点，即水由液态变为固态的温度。
每次,zh_dic,zh_dic_word_lookup.meaning_lookup,False,zh_dic_word_lookup.meaning_lookup,小猴没找到每次的意思，我先把它记下来
维权,zh_dic,zh_dic_word_lookup.meaning_lookup,False,zh_dic_word_lookup.meaning_lookup,小猴没找到维权的意思，我先把它记下来
执迷,zh_dic,zh_dic_word_lookup.meaning_lookup,False,zh_dic_word_lookup.meaning_lookup,小猴没找到执迷的意思，我先把它记下来
回生,zh_dic,zh_dic_word_lookup.meaning_lookup,False,zh_dic_word_lookup.meaning_lookup,小猴没找到回生的意思，我先把它记下来
麻麻黑,baike,baike,True,baike,麻麻黑: 拼音mā mɑ hēi ㄇㄚ ㄇㄚ ㄏㄟ解释麻麻黑 1. 天刚黑或天快黑 2. 方言。
犯不上,chat,chat.small_talk,False,chat.small_talk,我们先不要聊天啦，好好学习吧！
搭车,,poem_title_lookup.content_lookup,True,poem_title_lookup.content_lookup,大车 ，先秦， 佚名 ，大车槛槛，毳衣如菼。岂不尔思？畏子不敢。大车啍啍，毳衣如璊。岂不尔思？畏子不奔。榖则异室，死则同穴。谓予不信，有如皦日。
殿宇,zh_dic,zh_dic_word_lookup.meaning_lookup,False,zh_dic_word_lookup.meaning_lookup,小猴没找到殿宇的意思，我先把它记下来
菜鸟,baike,baike,True,baike,菜鸟是一个网络用语，一指新手，二指在某方面应用水平较低者。 某个人刚刚加入某个团队，或某个组织刚刚进入某个行业，适应环境，接受新的事物，都是需要一个过程的，处在这个过程阶段的人或组织，就叫菜鸟。
宰制,baike,baike,False,baike,抱歉，小猴答不上来
如期而至,zh_dic,zh_dic_idiom_lookup.meaning_lookup,False,zh_dic_idiom_lookup.meaning_lookup,小猴没找到如期而至这个成语，我先把它记下来
昂奋,zh_dic,zh_dic_word_lookup.meaning_lookup,False,zh_dic_word_lookup.meaning_lookup,小猴没找到昂奋的意思，我先把它记下来
好一阵,chat,chat.small_talk,False,chat.small_talk,我们先不要聊天啦，好好学习吧！
黄花鱼,,poem_title_lookup.content_lookup,True,poem_title_lookup.content_lookup,黄鱼 ，唐代， 杜甫 ，日见巴东峡，黄鱼出浪新。脂膏兼饲犬，长大不容身。筒桶相沿久，风雷肯为神。泥沙卷涎沫，回首怪龙鳞。
渔妇,,poem_title_lookup.content_lookup,True,poem_title_lookup.content_lookup,渔父 ，宋代， 李龏 ，岁俭何曾敢吃浆，早于世路似忘羊。桃花饭有秦人味，不染膏粱脂腻香。
喝醉,zh_dic,zh_dic_word_lookup.meaning_lookup,False,zh_dic_word_lookup.meaning_lookup,小猴没找到喝醉的意思，我先把它记下来
寓目,,poem_title_lookup.content_lookup,True,poem_title_lookup.content_lookup,寓目 ，唐代， 李商隐 ，园桂悬心碧，池莲饫眼红。此生真远客，几别即衰翁。小幌风烟入，高窻雾雨通。新知他日好，锦瑟傍朱栊。
生命垂危,zh_dic,no_task,False,no_task,抱歉，小猴没理解。
珠玉,baike,baike,True,baike,《珠玉词》是北宋晏殊的著作。作者承南唐冯延已余风，令词居多，虽内容单调，但词风特为婉丽，对宋初词坛有一定影响。明代毛晋尝据旧刻本重加考订，得词131首。之后，《四库全书》、《四部备要》等皆据以收录。有汲古阁刊本。
引论,baike,baike,False,baike,抱歉，小猴答不上来
熟铁,baike,baike,True,baike,熟铁: 熟铁是指用生铁精炼而成的比较纯的铁。概述: 用生铁精炼而成的比较。
兼济天下,,poem_sentence_lookup.content_lookup,True,poem_sentence_lookup.content_lookup,"这是同宋参军之问梦赵六赠卢陈二子之作中的诗句
同宋参军之问梦赵六赠卢陈二子之作 ，唐代， 陈子昂 ，晓霁望嵩丘，白云半巖足。氛氲涵翠微，宛如嬴台曲。故人昔所尚，幽琴歌断续。变化竟无常，人琴遂两亡。白云失处所，梦想暧容光。畴昔疑缘业，儒道两相妨。前期许幽报，迨此尚茫茫。晤言既已失，感叹情何一。始忆携手期，云台与峨眉。达兼济天下，穷独善其时。诸君推管乐，之子慕巢夷。奈何苍生望，卒为黄绶欺。铭鼎功未立，山林事亦微。抚孤一流恸，怀旧日暌违。卢子尚高节，终南卧松雪。宋侯逢圣君，骖驭游青云。而我独蹭蹬，语默道犹屯。征戍在辽阳，蹉跎草再黄。丹丘恨不及，白露已苍苍。远闻山阳赋，感涕下沾裳。"
狐媚,zh_dic,zh_dic_word_lookup.meaning_lookup,False,zh_dic_word_lookup.meaning_lookup,小猴没找到狐媚的意思，我先把它记下来
附庸国,baike,baike,True,baike,附庸国: 附庸国是指在别的宗主国轻度统治之下，没有自己主权自由的的国家。状态: 已消失。
凉菜,baike,baike,True,baike,凉菜（外文名：Cold Dishes ），在饮食业俗称冷盘。它是具有独特风格，拼摆技术性强的菜肴，食用时数都是吃凉的，称之为凉菜。凉菜切配的主要原料大部分是熟料，因此这与热菜烹调方法有着截然的区别，它的主要特点是：选料精细、口味干香、脆嫩、爽口不腻，色泽艳丽，造形整齐美观，拼摆和谐悦目。在上餐次序上，冷菜通常都是放在最前面，起到点饥，开胃的作用。
寄寓,zh_dic,zh_dic_word_lookup.meaning_lookup,False,zh_dic_word_lookup.meaning_lookup,小猴没找到寄寓的意思，我先把它记下来
房主,zh_dic,zh_dic_word_lookup.meaning_lookup,False,zh_dic_word_lookup.meaning_lookup,小猴没找到房主的意思，我先把它记下来
豆汁,baike,baike,True,baike,豆汁儿是老北京独具特色的传统小吃。
打道回府,zh_dic,zh_dic_idiom_lookup.meaning_lookup,False,zh_dic_idiom_lookup.meaning_lookup,小猴没找到打道回府这个成语，我先把它记下来
回眸,zh_dic,zh_dic_word_lookup.meaning_lookup,False,zh_dic_word_lookup.meaning_lookup,小猴没找到回眸的意思，我先把它记下来
跪拜,zh_dic,zh_dic_word_lookup.meaning_lookup,False,zh_dic_word_lookup.meaning_lookup,小猴没找到跪拜的意思，我先把它记下来
个展,baike,baike,True,baike,个展: 个展是一个汉语词语，读音是gè zhǎn，是指个人作品展出。
渔人,,poem_title_lookup.content_lookup,True,poem_title_lookup.content_lookup,渔人 ，唐代， 王炎 ，西南月未堕，白雾吞青山。渡口无人行，老渔一舟还。呵手系短缆，袯襫犯夜寒。捕鱼养妻子，谁谓斯人闲。
下半晌,zh_dic,zh_dic_word_lookup.meaning_lookup,False,zh_dic_word_lookup.meaning_lookup,小猴没找到下半晌的意思，我先把它记下来
炎火,baike,baike,True,baike,炎火: 炎火是一个汉语词汇，拼音yán huǒ ，解释一是指烈火，解释二是指传说中的火焰山。
仕宦,zh_dic,zh_dic_word_lookup.meaning_lookup,False,zh_dic_word_lookup.meaning_lookup,小猴没找到仕宦的意思，我先把它记下来
北方方言,baike,baike,False,baike,抱歉，小猴答不上来
看不上,chat,chat.small_talk,False,chat.small_talk,我们先不要聊天啦，好好学习吧！
气绝,zh_dic,zh_dic_word_lookup.meaning_lookup,False,zh_dic_word_lookup.meaning_lookup,小猴没找到气绝的意思，我先把它记下来
进账,zh_dic,zh_dic_word_lookup.meaning_lookup,False,zh_dic_word_lookup.meaning_lookup,小猴没找到进账的意思，我先把它记下来
生拉硬扯,zh_dic,no_task,False,no_task,抱歉，小猴没理解。
虚度光阴,zh_dic,zh_dic_idiom_lookup.meaning_lookup,False,zh_dic_idiom_lookup.meaning_lookup,小猴没找到虚度光阴这个成语，我先把它记下来
立地,zh_dic,zh_dic_word_lookup.meaning_lookup,False,zh_dic_word_lookup.meaning_lookup,小猴没找到立地的意思，我先把它记下来
复生,,poem_title_lookup.content_lookup,True,poem_title_lookup.content_lookup,浮生 ，宋代， 陆游 ，浮生过六十，百念已颓然。独有躭书癖，犹同总角年。横陈粝饭侧，朗诵短檠前。不用嘲痴绝，儿曹尚可传。
