raw_value,nlu_skill,nlu_task,nlu_result_is_valid,nlu_result_tts_task_type,nlu_result_tts_text
泰极生否,,poem_sentence_lookup.content_lookup,True,poem_sentence_lookup.content_lookup,"这是大宋中兴雅中的诗句
大宋中兴雅 ，宋代， 李正民 ，炎正中微，泰极而否。边陲云扰，中原糜沸。靖康之元，逼我京师。金汤弛备，兵缠紫微。天方佑宋，帝在济阳。貔貅十万，左右陈行。旌旗蔽野，戈鋋彗云。八神警跸，七萃骏奔。移师商丘，亿兆乐推。讴歌狱讼，竭蹶咸归。爰登宝位，爰绍丕基。兢兢业业，一日万机。既巡淮甸，乃涖浙江。遣使聘问，原隰相望。两宫未复，夙夜靡遑。经之营之，十有馀年。戊午之秋，使车来旋。谓彼邻国，远达温言。欲讲盟好，厥志已坚。使在淮浦，众言盈庭。如蜩如螗，如沸如羹。更唱迭和，万口狺狺。帝若不闻，默与神谋。圣志先定，惟相是诹。轺车戾止，和好是求。复我河南，旧县与州。疆界方交，左贤被罪。谋臣既歼，信誓中悔。古贤继之，矜其勇鸷。氛尘冥冥，侵我淮泗。帝赫斯怒，张我皇威。乃敕六将，建尔鼓旗。追奔逐北，于淮之湄。师入陈许，亦反濉涣。两都震惧，人心冰泮。元戎駃马，往告于金。羣情愕眙，罔敢来侵。皇天悔祸，殊邻革心。按兵于境，旧盟是寻。锡以金帛，稛载方舟。皇华络绎，典礼具修。载书孔明，戎车遄迈。质于鬼神，万世永赖。龙楯来归，兆庶雨泣。圣心孺慕，哀恫罔极。百神毕会，缵禹之迹。永祐后昆，山川叶吉。长乐就养，袆衣褕翟。万寿称觞，怡心顺色。晨羞既进，夕膳载加。天子之孝，修于邦家。归马散牛，句戈束矢。大将释师，军政咸理。淮滨之民，夜眠晏起。秉尔耒耜，或耘或宣，惟仲山甫。爱莫助之，民鲜克举。我宋之隆，君臣会通。咸有一德，协于尹躬。中兴之功，薰灼夷夏。臣作是诗，以继周雅。"
五痨七伤,zh_dic,zh_dic_idiom_lookup.meaning_lookup,False,zh_dic_idiom_lookup.meaning_lookup,小猴没找到五痨七伤这个成语，我先把它记下来
玉轮,baike,baike,True,baike,玉轮: 玉轮是汉语词语，读音是yù lún，意为月的别名。
敬拜,zh_dic,zh_dic_word_lookup.meaning_lookup,False,zh_dic_word_lookup.meaning_lookup,小猴没找到敬拜的意思，我先把它记下来
芙蓉花,,poem_title_lookup.content_lookup,True,poem_title_lookup.content_lookup,芙蓉花 ，宋代， 董嗣杲 ，如馆如城几艳丛，拒霜不觉老西风。曼卿人见骑驴去，丁度仙游按辔空。惆怅二公皆死谶，浅深十里尚秋红。且图席地看花醉，肯羡豪家绣褥工。
胡桃,,poem_title_lookup.content_lookup,True,poem_title_lookup.content_lookup,胡桃 ，宋代， 释普济 ，枝头叶底不能藏，独脱无依未厮当。一击浑身如粉碎，不堪收拾始馨香。
交游,,poem_title_lookup.content_lookup,True,poem_title_lookup.content_lookup,交游 ，宋代， 黄裳 ，率尔相会遇，欣然同醉吟。意外谈笑易，胸中矛戟深。契合好甘醴，听闻嫌正音。交结自此始，刎颈当知心。
数不上,chat,chat.small_talk,False,chat.small_talk,我们先不要聊天啦，好好学习吧！
毫不在意,zh_dic,zh_dic_idiom_lookup.meaning_lookup,False,zh_dic_idiom_lookup.meaning_lookup,小猴没找到毫不在意这个成语，我先把它记下来
棒槌,zh_dic,zh_dic_word_lookup.meaning_lookup,False,zh_dic_word_lookup.meaning_lookup,小猴没找到棒槌的意思，我先把它记下来
黯然无光,zh_dic,zh_dic_idiom_lookup.meaning_lookup,False,zh_dic_idiom_lookup.meaning_lookup,小猴没找到黯然无光这个成语，我先把它记下来
代为,zh_dic,zh_dic_word_lookup.meaning_lookup,False,zh_dic_word_lookup.meaning_lookup,小猴没找到代为的意思，我先把它记下来
芭蕉扇,baike,baike,False,baike,抱歉，小猴答不上来
勾绘,zh_dic,zh_dic_word_lookup.meaning_lookup,False,zh_dic_word_lookup.meaning_lookup,小猴没找到勾绘的意思，我先把它记下来
惩恶扬善,,poem_sentence_lookup.content_lookup,True,poem_sentence_lookup.content_lookup,"这是太上感应篇中的诗句
太上感应篇 ，宋代， 李昌龄 ，太上曰：祸福无门，唯人自召。善恶之报，如影随形。是以天地有司过之神依人所犯轻重，以夺人算。算减则贫耗，多逢忧患，人皆恶之，刑祸随之，吉庆避之，恶星灾之，算尽则死。又有三台北斗神君，在人头上，录人罪恶，夺其纪算。又有三尸神，在人身中，每到庚申日，辄上诣天曹，言人罪过。月晦之日，灶神亦然。凡人有过，大则夺纪，小则夺算。其过大小，有数百事，欲求长生者，先须避之。是道则进，非道则退。不履邪径，不欺暗室。积德累功，慈心于物。忠孝友悌，正己化人，矜孤恤寡，敬老怀幼。昆虫草木，犹不可伤。宜悯人之凶，乐人之善，济人之急，救人之危。见人之得，如己之得。见人之失，如己之失。不彰人短，不炫己长。遏恶扬善，推多取少。受辱不怨，受宠若惊。施恩不求报，与人不追悔。所谓善人，人皆敬之，天道佑之，福禄随之。众邪远之，神灵卫之，所作必成，神仙可冀。欲求天仙者，当立一千三百善，欲求地仙者，当立三百善；苟或非义而动，背理而行。以恶为能，忍作残害。阴贼良善，暗侮君亲。慢其先生，叛其所事。诳诸无识，谤诸同学。虚诬诈伪，攻讦宗亲。刚强不仁，狠戾自用。是非不当，向背乖宜。虐下取功，谄上希旨。受恩不感，念怨不休。轻蔑天民，扰乱国政。赏及非义，刑及无辜。杀人取财，倾人取位。诛降戮服，贬正排贤。凌孤逼寡，弃法受赂。以直为曲，以曲为直。入轻为重，见杀加怒。知过不改，知善不为。自罪引他，壅塞方术。讪谤贤圣，侵凌道德。射飞逐走，发蛰惊栖，填穴复巢，伤胎破卵。愿人有失，毁人成功。危人自安，减人自益。以恶易好，以私废公。窃人之能，蔽人之善。形人之丑，讦人之私。耗人货财，离人骨肉。侵人所爱，助人为非，逞志作威，辱人求胜。败人苗稼，破人婚姻。苟富而骄，苟免无耻，认恩推过。嫁祸卖恶。沽买虚誉，包贮险心。挫人所长，护己所短。乘威迫胁，纵暴杀伤。无故剪裁，非礼烹宰。散弃五谷，劳扰众生。破人之家。取其财宝。决水放火，以害民居，紊乱规模，以败人功，损人器物，以穷人用。见他荣贵，愿他流贬。见他富有，愿他破散。见他色美，起心私之。负他货财，原他身死。干求不遂，便生咒恨。见他失便，便说他过。见他体相不具而笑之。见他才能可称而抑之。埋蛊厌人，用药杀树。恚怒师傅，抵触父兄。强取强求，好侵好夺。掳掠致富，巧诈求迁。赏罚不平，逸乐过节。苛虐其下，恐吓于他。怨天尤人，呵风骂雨。斗合争讼，妄逐朋党。用妻妾语，违父母训。得新忘故。口是心非，贪冒于财，欺罔其上。造作恶语，谗毁平人。毁人称直，骂神称正，弃顺效逆，背亲向疏。指天地以证鄙怀，引神明而鉴猥事。施与后悔，假借不还。分外营求，力上施设。淫欲过度，心毒貌慈。秽食馁人，左道惑众。短尺狭度，轻秤小升。以伪杂真，采取奸利。压良为贱，谩蓦愚人，贪婪无厌，咒诅求直。嗜酒悖乱，骨肉忿争。男不忠良，女不柔顺。不和其室，不敬其夫。每好矜夸，常行妒忌。无行于妻子，失礼于舅姑，轻慢先灵，违逆上命。作为无益，怀挟外心。自咒咒他，偏憎偏爱。越井越灶，跳食跳人。损子堕胎，行多隐僻。晦腊歌舞，朔旦号怒。对北涕唾及溺，对灶吟咏及哭。又以灶火烧香，秽柴作食。夜起裸露，八节行刑。唾流星，指虹霓。辄指三光，久视日月，春月燎猎，对北恶骂。无故杀龟打蛇，如是等罪，司命随其轻重，夺其纪算。算尽则死，死有馀责，乃殃及子孙。又诸横取人财者，乃计其妻子家口以当之，渐至死丧。若不死丧，则有水火盗贼，遗亡器物，疾病口舌诸事，以当妄取之直。又枉杀人者，是易刀兵而相杀也。取非羲之财者，譬如漏脯救饥，鸩酒止渴，非不暂饱，死亦及之。夫心起于善，善虽未为，而吉神已随之。或心起于恶，恶虽未为，而凶神已随之。其有曾行恶事，后自改悔，诸恶莫作，众善奉行。久久必获吉庆，所谓转祸为福也。故吉人语善，视善，行善。一日有三善，三年天必降之福。凶人语恶视恶行恶，一日有三恶，三年天必降之祸，胡不勉而行之。"
闭门谢客,zh_dic,zh_dic_idiom_lookup.meaning_lookup,False,zh_dic_idiom_lookup.meaning_lookup,小猴没找到闭门谢客这个成语，我先把它记下来
马褂,baike,baike,True,baike,马褂: 马褂是服饰名 ，对襟、平袖端、盘扣、身长至腰，前襟缀扣襻五枚。样式: 大襟马褂、对襟马褂等。
早育,zh_dic,zh_dic_word_lookup.meaning_lookup,False,zh_dic_word_lookup.meaning_lookup,小猴没找到早育的意思，我先把它记下来
老少无欺,zh_dic,zh_dic_idiom_lookup.meaning_lookup,False,zh_dic_idiom_lookup.meaning_lookup,小猴没找到老少无欺这个成语，我先把它记下来
忘年交,baike,baike,False,baike,抱歉，小猴答不上来
台本,baike,baike,False,baike,抱歉，小猴答不上来
联通,baike,baike,True,baike,同“连通”。
泪液,baike,baike,False,baike,抱歉，小猴答不上来
大气圈,baike,baike,True,baike,大气圈: 大气层 atmosphere 又叫大气圈，地球就被这一层很厚的大气层包围着。
艳阳高照,,poem_sentence_lookup.content_lookup,True,poem_sentence_lookup.content_lookup,"这是清平乐 其一 毛主席种地处中的诗句
清平乐 其一 毛主席种地处 ，当代， 杨鸿章 ，朝阳高照。万道霞光耀。主席坡前培谷稻。碧柳红桃迎笑。银锄斩棘披荆。汗珠润土滋根。育出壮苗亿万，神州一圃新春。"
出聘,zh_dic,zh_dic_word_lookup.meaning_lookup,False,zh_dic_word_lookup.meaning_lookup,小猴没找到出聘的意思，我先把它记下来
口误,zh_dic,zh_dic_word_lookup.meaning_lookup,False,zh_dic_word_lookup.meaning_lookup,小猴没找到口误的意思，我先把它记下来
杜宇,,poem_title_lookup.content_lookup,True,poem_title_lookup.content_lookup,杜宇 ，宋代， 周承勋 ，四海常为客，三春却倦游。能飞归不得，虽去有何求。故国千年恨，行人万里愁。年来风过耳，无泪与君流。
解甲释兵,zh_dic,zh_dic_idiom_lookup.meaning_lookup,False,zh_dic_idiom_lookup.meaning_lookup,小猴没找到解甲释兵这个成语，我先把它记下来
黄梅雨,baike,baike,False,baike,抱歉，小猴答不上来
战抖,zh_dic,zh_dic_word_lookup.meaning_lookup,False,zh_dic_word_lookup.meaning_lookup,小猴没找到战抖的意思，我先把它记下来
甜椒,baike,baike,True,baike,甜椒是一种属于管状花目、茄科、茄族、辣椒属、辣椒种的一年生或多年生的草本植物，其椒果肉厚而脆嫩，维生素C的含量较为丰富。甜椒是由原产于中南美洲热带地区的辣椒在北美演化而来，经过长期栽培和人工选择，使果实发生了体积增大、果肉变厚、辣味消失和心皮及子房腔数增多等性状变化。
储君,baike,baike,True,baike,储君: 储君：指王位或皇位的继承人。解释: 帝王的继承者。
胡麻,baike,baike,True,baike,胡麻是一种油料作物。
张嘴结舌,zh_dic,zh_dic_idiom_lookup.meaning_lookup,False,zh_dic_idiom_lookup.meaning_lookup,小猴没找到张嘴结舌这个成语，我先把它记下来
娼妇,baike,baike,False,baike,抱歉，小猴答不上来
喜丧,zh_dic,zh_dic_word_lookup.meaning_lookup,False,zh_dic_word_lookup.meaning_lookup,小猴没找到喜丧的意思，我先把它记下来
时俗,zh_dic,zh_dic_word_lookup.meaning_lookup,False,zh_dic_word_lookup.meaning_lookup,小猴没找到时俗的意思，我先把它记下来
朱颜绿鬓,,poem_sentence_lookup.content_lookup,True,poem_sentence_lookup.content_lookup,"这是促拍丑奴儿（寿孟万户）中的诗句
促拍丑奴儿（寿孟万户） ，宋代， 邓剡 ，睡起怯春寒。海棠花开未开间。莫言春色三分二，朱颜绿鬓，栽花种竹，谁似群闲。侯印旧家毡。早天边飞诏催还。从今几岁岁称觞处，人如玉雪，花如锦绣，福寿如山。"
生意盎然,zh_dic,zh_dic_idiom_lookup.meaning_lookup,False,zh_dic_idiom_lookup.meaning_lookup,小猴没找到生意盎然这个成语，我先把它记下来
速递,baike,baike,True,baike,速递又名快递（英语：Courier），是指寄送物品的服务，属于物流的范畴之一，与邮递相当类似，但快递可寄送比较大件的物品，例如书籍、网络购物物品等。除了专门提供快递服务的业者外，各地的邮政系统也多有快递服务。除了较快送抵目的地及必须签收外，现时很多快递业者均提供货件追踪功能、送递时间的承诺及其他按客户需要提供的服务。因此，快递的收费比一般邮递昂贵。
老夫,,poem_title_lookup.content_lookup,True,poem_title_lookup.content_lookup,老夫 ，唐代， 白居易 ，七八年来游洛都，三分游伴二分无。风前月下花园里，处处唯残个老夫。世事劳心非富贵，人间实事是欢娱。谁能逐我来闲坐，时共酣歌倾一壶。
有模有样,,poem_sentence_lookup.content_lookup,True,poem_sentence_lookup.content_lookup,"这是觉际融长老请赞中的诗句
觉际融长老请赞 ，宋代， 释师范 ，无箇模样，画箇模样。既有模样，是甚模样。节节危梁十二层，垂垂白发三千丈。"
疲累,zh_dic,zh_dic_word_lookup.meaning_lookup,False,zh_dic_word_lookup.meaning_lookup,小猴没找到疲累的意思，我先把它记下来
节子,,poem_title_lookup.content_lookup,True,poem_title_lookup.content_lookup,诫子 ，宋代， 何梦桂 ，鲁语诲时习，商书称时敏。一字该二义，学者盍重省。又日新其德，成汤常自儆。三月不违仁，颜子独深领。今日或因循，明日澡即新。前月或断续，此月复即仁。圣贤惜分阴，于此犹兢兢。学者能用力，其名曰竞辰。人有一大时，一去不复仍。十五入大学，明德与新民。二十曰弱冠，既冠责成人。勤怠只数年，贤愚系终身。过此为失时，人不再青春。譬之农力穑，春耕而夏耘。耕耘苟失时，无复望秋成。父母上俱存，兄弟下无故。饱食无用心，白日任虚度。幼壮老复至，一朝忽反顾。对人语不了，握笔书辄误。龙鳞映犬豕，面目可憎恶。哀哉复哀哉，追悔已迟暮。及此尚可图，勉旃须早悟。
国势,baike,baike,True,baike,国势: 1901，在中国国运衰微、几乎亡国灭种的危机时刻，时空变换，秦时竹等谱写了中华复兴的传奇。
胡言,,poem_title_lookup.content_lookup,True,poem_title_lookup.content_lookup,胡雁 ，宋代， 蔡襄 ，胡雁畏空漠，群飞向洲渚。褰云避射戈，万里声悲苦。月色满关河，欲下迷处所。春江沙平净，鱼蚌不可数。饱暖身肥腴，归路欲远举。寻常弓箭儿，仰视随意取。从来远祸心，狼借失旧侣。小哉衔芦智，岂识保身语。
锻打,zh_dic,zh_dic_word_lookup.meaning_lookup,False,zh_dic_word_lookup.meaning_lookup,小猴没找到锻打的意思，我先把它记下来
桥孔,baike,baike,False,baike,抱歉，小猴答不上来
方外之士,zh_dic,zh_dic_idiom_lookup.meaning_lookup,False,zh_dic_idiom_lookup.meaning_lookup,小猴没找到方外之士这个成语，我先把它记下来
刑事诉讼,baike,baike,True,baike,我国的刑事诉讼是指人民法院、人民检察院和公安机关在当事人及其他诉讼参与人的参加下，依照法律规定的程序，解决被追诉者刑事责任问题的活动。根据诉讼的内容和形式不同，诉讼活动可以具体分为刑事诉讼、民事诉讼和行政诉讼三部分。其中，刑事诉讼是指审判机关（人民法院）、检察机关（人民检察院）和侦查机关（公安机关含国家安全机关等）在当事人以及诉讼参与人的参加下，依照法定程序解决被追诉者刑事责任问题的诉讼活动。
螳螂挡车,baike,baike,True,baike,螳螂挡车: 语出《庄子-人间世》说，螳螂“怒其臂以当车辙，不知其不胜任也。
断根,zh_dic,zh_dic_word_lookup.meaning_lookup,False,zh_dic_word_lookup.meaning_lookup,小猴没找到断根的意思，我先把它记下来
霍然,baike,baike,False,baike,抱歉，小猴答不上来
兰草,baike,baike,True,baike,兰草一般是指葱兰、墨兰、春兰、蕙兰等，兰草的叶片为长椭圆形、披针形或是长椭圆披针形，叶片的正反面都十分的光滑，叶子的边缘有小锯齿。兰花的叶片为倒披针形，它是两列生长的，叶子的边缘上相对比较光滑；兰草的花是头状花序，大部分是在茎的顶部以及枝端，排列而成的伞房花序，兰草花为白色，或是带有微红色。
黄花,,poem_title_lookup.content_lookup,True,poem_title_lookup.content_lookup,黄花 ，宋代， 朱淑真 ，土花能白又能红，晚节犹能爱此工。宁可抱香枝上老，不随黄叶舞秋风。
怕是,chat,chat.small_talk,False,chat.small_talk,我们先不要聊天啦，好好学习吧！
调干,zh_dic,zh_dic_word_lookup.meaning_lookup,False,zh_dic_word_lookup.meaning_lookup,小猴没找到调干的意思，我先把它记下来
大漠,baike,baike,True,baike,"大漠: 大漠, 来自内地实力兼才华的男歌手。所属地区: 新疆。"
雏鸟,baike,baike,True,baike,雏鸟[生物学名称]: 雏鸟（英文名称：Nestling）：指不能独立生活的幼小鸟类。所属: 生物学。
舅子,baike,baike,True,baike,舅子: 舅子，是汉语词汇，出自《晋书·羊祜传》，解释为男子对妻子的弟弟或者哥哥的称谓。
衣橱,zh_dic,zh_dic_word_lookup.meaning_lookup,False,zh_dic_word_lookup.meaning_lookup,小猴没找到衣橱的意思，我先把它记下来
暴食,,poem_title_lookup.content_lookup,True,poem_title_lookup.content_lookup,饱食 ，宋代， 陆游 ，饱食无功媿汗青，灯前顾影叹伶俜。马衰犹养疑知路，龟久当捐为不灵。腰下徒夸绶若若，镜中何止发星星。石帆回首初非远，要及清秋斸茯苓。
讣闻,zh_dic,zh_dic_word_lookup.meaning_lookup,False,zh_dic_word_lookup.meaning_lookup,小猴没找到讣闻的意思，我先把它记下来
分一杯羹,,poem_sentence_lookup.content_lookup,True,poem_sentence_lookup.content_lookup,"这是寄海安赵路分中的诗句
寄海安赵路分 ，宋代， 宋伯仁 ，雨湿中秋节，重阳始得晴。菊花荣辱重，萍梗去留轻。诗卷抄无尽，乡书写未成。鲈鱼如钓得，分我一杯羹。"
暖乎乎,zh_dic,zh_dic_word_lookup.meaning_lookup,False,zh_dic_word_lookup.meaning_lookup,小猴没找到暖乎乎的意思，我先把它记下来
德性,,poem_title_lookup.content_lookup,True,poem_title_lookup.content_lookup,得性 ，宋代， 释文珦 ，得性贤于得禄，归山胜似归朝。饮涧肺肠清浄，卧云魂梦逍遥。
回溯,zh_dic,zh_dic_word_lookup.meaning_lookup,False,zh_dic_word_lookup.meaning_lookup,小猴没找到回溯的意思，我先把它记下来
磕巴,zh_dic,zh_dic_word_lookup.meaning_lookup,False,zh_dic_word_lookup.meaning_lookup,小猴没找到磕巴的意思，我先把它记下来
花芽,baike,baike,True,baike,花芽: 芽（ya）是维管植物（蕨类和种子植物）中尚未充分发育和伸长的枝条或花，实际上是枝条或花的雏型。界: 植物界。
囫囵,zh_dic,zh_dic_word_lookup.meaning_lookup,False,zh_dic_word_lookup.meaning_lookup,小猴没找到囫囵的意思，我先把它记下来
灯心,,poem_title_lookup.content_lookup,True,poem_title_lookup.content_lookup,灯薪 ，宋代， 郑清之 ，小草虚心不染尘，传灯会上屡焚身。光明一点元无尽，谩结空花作好春。
中途而废,zh_dic,zh_dic_idiom_lookup.meaning_lookup,False,zh_dic_idiom_lookup.meaning_lookup,小猴没找到中途而废这个成语，我先把它记下来
各奔东西,,poem_title_lookup.content_lookup,True,poem_title_lookup.content_lookup,各东西 ，唐代， 张籍 ，游人别，一东复一西。出门相背两不返，惟信车轮与马蹄。道路悠悠不知处，山高海阔谁辛苦。远游不定难寄书，日日空寻别时语。浮云上天雨堕地，暂时会合终离异。我今与子非一身，安得死生不相弃。
保有,zh_dic,zh_dic_word_lookup.meaning_lookup,False,zh_dic_word_lookup.meaning_lookup,小猴没找到保有的意思，我先把它记下来
叫花子,baike,baike,True,baike,叫花子→叫化子→教化子。启源于佛教苦修行者，吃的是百家饭，从乞讨中能体悟到生活的真帝。多年的修行教化后回到寺庙成为兄长→主持，再修练成方丈。固而民间的乞讨就叫花子。
泛泛,zh_dic,zh_dic_word_lookup.meaning_lookup,False,zh_dic_word_lookup.meaning_lookup,小猴没找到泛泛的意思，我先把它记下来
细致入微,zh_dic,zh_dic_idiom_lookup.meaning_lookup,False,zh_dic_idiom_lookup.meaning_lookup,小猴没找到细致入微这个成语，我先把它记下来
日偏食,baike,baike,False,baike,抱歉，小猴答不上来
曲曲折折,zh_dic,zh_dic_idiom_lookup.meaning_lookup,False,zh_dic_idiom_lookup.meaning_lookup,小猴没找到曲曲折折这个成语，我先把它记下来
怕死鬼,chat,chat.small_talk,False,chat.small_talk,我们先不要聊天啦，好好学习吧！
窗幔,zh_dic,zh_dic_word_lookup.meaning_lookup,False,zh_dic_word_lookup.meaning_lookup,小猴没找到窗幔的意思，我先把它记下来
眼镜蛇,baike,baike,True,baike,眼镜蛇（学名：Naja）为眼镜蛇属动物的通称，是眼镜蛇科的一属，其成员大多被统称为眼镜蛇。虽然世上也有不少其他蛇类的名字包含“眼镜蛇”（Cobra)一称（如眼镜王蛇、水眼镜蛇、唾蛇），但它们因演化亲缘性不足而并不归为此属。 眼镜蛇属目前约有20多个已确认物种，但分类学上经常就物种的独立性问题而存有争论，因此某些资料也可能有所出入。此属的成员主要分布于中东、东南亚、非洲、印度尼西亚等地。
负效应,baike,baike,False,baike,抱歉，小猴答不上来
朝四暮三,,poem_sentence_lookup.content_lookup,True,poem_sentence_lookup.content_lookup,"这是宋宗儒真赞中的诗句
宋宗儒真赞 ，宋代， 黄庭坚 ，宋子勃窣，心有古镜。朝四暮三，为笑不竞。放一捻一，犹着禅病。探丸起死，味药知性。忧患不入乎杯中，抱胡琴而风听。若乃脱冠袒裼，扪蝨应客。目如愁胡，拊髀而唿。是必追橡栗于云杪，探水月于江湖，然后怏于心与。"
皴裂,baike,baike,True,baike,皴裂，是汉语词汇，是发生在手足的深浅不一的裂纹。其既是一些皮肤病的伴随症状，也可作为一种独立的皮肤病。皴裂要注意手的养护，冬季注意保暖。
爱才好士,zh_dic,zh_dic_idiom_lookup.meaning_lookup,False,zh_dic_idiom_lookup.meaning_lookup,小猴没找到爱才好士这个成语，我先把它记下来
名扬天下,zh_dic,zh_dic_idiom_lookup.meaning_lookup,False,zh_dic_idiom_lookup.meaning_lookup,小猴没找到名扬天下这个成语，我先把它记下来
涉世未深,zh_dic,no_task,False,no_task,抱歉，小猴没听懂。
下网,zh_dic,zh_dic_word_lookup.meaning_lookup,False,zh_dic_word_lookup.meaning_lookup,小猴没找到下网的意思，我先把它记下来
绝灭,zh_dic,zh_dic_word_lookup.meaning_lookup,False,zh_dic_word_lookup.meaning_lookup,小猴没找到绝灭的意思，我先把它记下来
青涩,zh_dic,zh_dic_word_lookup.meaning_lookup,False,zh_dic_word_lookup.meaning_lookup,小猴没找到青涩的意思，我先把它记下来
名利兼收,zh_dic,no_task,False,no_task,抱歉，小猴没听清。
纵横交叉,zh_dic,no_task,False,no_task,抱歉，小猴没听清。
实打实,zh_dic,zh_dic_word_lookup.meaning_lookup,False,zh_dic_word_lookup.meaning_lookup,小猴没找到实打实这个词，我先把它记下来
除却,zh_dic,zh_dic_word_lookup.meaning_lookup,False,zh_dic_word_lookup.meaning_lookup,小猴没找到除却的意思，我先把它记下来
翻盖,zh_dic,zh_dic_word_lookup.meaning_lookup,False,zh_dic_word_lookup.meaning_lookup,小猴没找到翻盖的意思，我先把它记下来
借酒消愁,,poem_sentence_lookup.content_lookup,True,poem_sentence_lookup.content_lookup,"这是阮郎归 郭延年诞日中的诗句
阮郎归 郭延年诞日 ，宋代， 李俊民 ，断蓬踪迹去依刘。试登王粲楼。此心安处即菟裘。尚何来往求。诗遣兴，酒消愁。竹林多胜游。与君何日共仙舟。相看应白头。"
讹传,baike,baike,True,baike,讹传: 讹传，指与事实、事件等不相符的谣言。
淡月,baike,baike,True,baike,淡月: 淡月dàn yuè是指天空有云雾，看不清楚月亮，月光淡淡。解释: 月光淡淡。
划子,zh_dic,zh_dic_word_lookup.meaning_lookup,False,zh_dic_word_lookup.meaning_lookup,小猴没找到划子的意思，我先把它记下来
教本,zh_dic,zh_dic_word_lookup.meaning_lookup,False,zh_dic_word_lookup.meaning_lookup,小猴没找到教本的意思，我先把它记下来
